52600|Hillis-Müller maneuver|hil′is mil′ĕr|manual pressure on the term fundus while a finger in the vagina determines the descent of the head into the pelvis.
41005|hillock|hil′lok|In anatomy, any small elevation or prominence.
41009|Hilton|hil′tŏn|John, English surgeon, 1804–1878.
48197|Hilton law|hil′tŏn|the nerve supplying a joint supplies also the muscles which move the joint and the skin covering the articular insertion of those muscles.
54810|Hilton method|hil′tŏn|division of the nerves supplying a part, for the relief of pain in ulcers.
79285|Hilton sac|hil′tŏn|
50402|Hilton white line|hil′tŏn|
41010|hilum|hī′lŭm, hī′lă|The part of an organ where the nerves and vessels enter and leave.&#&A depression or slit resembling the hilum in the olivary nucleus of the brain.
41012|hilum glandulae suprarenalis||hilum of suprarenal gland.
41015|hilum lienale||
41018|hilum nodi lymphoidei||
41019|hilum nuclei dentati||
41020|hilum nuclei olivaris inferioris||
41011|hilum of dentate nucleus||the mouth of the flasklike dentate nucleus of the cerebellum, directed inward (rostromedial), and giving exit to many of the fibers that compose the superior cerebellar peduncle or brachium conjunctivum.
41013|hilum of inferior olivary nucleus||the medially oriented opening in the folded cell layer composing the inferior olivary nucleus through which the efferent fibers of the nucleus make their exit.
41014|hilum of kidney||the depression on the medial border of the kidney through which pass the segmental renal vessels and renal nerves and where the apex of the renal pelvis occurs.
41016|hilum of lung||a wedge-shaped depression on the mediastinal surface of each lung, where the bronchus, blood vessels, nerves, and lymphatics enter or leave the viscus.&#&radiologically, the composite shadow of the main pulmonary arteries, veins, and lymph nodes in the lung root adjacent to the anatomic hilum.
41017|hilum of lymph node||the depressed area of the surface of a lymph node through which the efferent lymphatics emerge from the medulla and through which blood vessels enter and leave the node.
41022|hilum of ovary||the depression along the mesovarian margin, at the insertion of the mesovarium, where vessels and nerves enter or leave the ovary.
41025|hilum of spleen||
41021|hilum ovarii||
41023|hilum pulmonis||
41024|hilum renale||
41027|hilum splenicum||
41028|hilus|hī′lŭs|Incorrect form of hilum.
15651|hilus cells||cells in the hilus of the ovary that produce androgens; they are thought to be the ovarian counterpart of the interstitial cells of the testis.
41029|himantosis|hī′man-tō′sis|An unusually long uvula.
47054|hind kidney||
41030|hindbrain|hīnd′brān|
72075|hindbrain primordium||the primary brain vesicle in the embryo that forms the hindbrain (rhombencephalon).
98424|hindbrain vesicle||
41031|hindgut|hīnd′gŭt|The caudal or terminal part of the embryonic gut.&#&Descending and sigmoid colon, rectum and superior two thirds of the anal canal.
41032|hindpelvis|hīnd-pel′vis|The portion of the pelvis (pelvic cavity) located posterior to a line defining the maximum transverse diameter of the superior pelvic aperture (inlet); most often the hindpelvis has a smaller capacity than the forepelvis, being much smaller in an android pelvis, and is more variable in shape due to variation in the prominence of the sacral vertebral bodies.
3089|hindquarter amputation||
41033|hindwater|hīnd′wah-tĕr|Colloquialism for amniotic fluid in utero behind the presenting part of the fetus.
90570|Hines-Brown test|hīnz brown|
8953|hinge axis||
46366|hinge joint||a uniaxial joint in which a broad, transversely cylindric convexity on one bone fits into a corresponding concavity on the other, allowing of motion in one plane only, as in the elbow.
56198|hinge movement||an opening or closing movement of the mandible on the hinge axis.
71328|hinge position||in dentistry, the orientation of parts in a manner permitting hinge movement between them.
77164|hinge region||in an immunoglobulin, a short sequence of amino acids that lies between two longer sequences and allows the latter to bend about the former.
41034|hinge-bow|hinj′bō|
33865|hinged flap||a flap of skin prepared surgically that moves in an arcing manner similar to turning the pages of a book.
41035|Hinman|hin′măn|Frank, Jr., 20th-century U.S. urologist.
88087|Hinman syndrome|hin′măn|
41036|Hinton|hin′tŏn|William A., U.S. physician, 1883–1959.
90571|Hinton test|hin′tŏn|a formerly widely used precipitin (flocculation) test for syphilis in which the “antigen” consisted of glycerol, cholesterol, and beef heart extract.
41037|hip|hip|The lateral prominence of the pelvis, extending from the waist to the thigh and formed by the iliac crest, the greater trochanter of the femur, and associated soft tissues.&#&Less precisely, the proximal parts of the femur, including the head, neck, and greater and lesser trochanters. It is this sense that is meant in the common phrases “hip fracture” and “hip nailing.” [anat. usage note to avoid ambiguity it may be advisable to add a specifying word (hip joint, hip region) or to avoid hip altogether (femoral neck fracture).]
11243|hip bone||a large flat bone formed by the fusion of the ilium, ischium, and pubis (in the adult), constituting the anterolateral portion of the pelvic girdle; it articulates with its fellow anteriorly at the pubic symphysis, with the sacrum posteriorly at the sacroiliac joint, and with the femur laterally at the hip joint.
27408|hip dysplasia||a chronic degenerative condition producing lameness in animals, of highest prevalence in particular dog breeds. Laxity of ligaments about the hip joint permits erosion of weight-bearing surfaces, which is exacerbated by strenuous exercise in rapidly growing dogs. Etiology is multifactorial. Radiographic correlation with clinical signs is poor.
35333|hip fracture||vernacular term for fracture of the femoral neck, typically resulting from a fall in an old person with osteoporosis; more common in women; requires surgical repair with internal fixation and can lead to prolonged or permanent loss of mobility and shortened life span.
46367|hip joint||the ball-and-socket synovial joint between the head of the femur and the acetabulum.
67956|hip phenomenon||
41053|hip pointer|hip poynt′ĕr|Traumatic subperiosteal hematoma of the pelvic girdle.
77165|hip region||region lateral to the gluteal region (buttock), inferior to the iliac crest and overlying the greater trochanter of the femur.
67957|hip-flexion phenomenon||when a hemiplegic attempts to rise from a lying posture, the hip on the paralyzed side is flexed first; the same movement takes place on lying down.
41039|HIPAA||Abbreviation for Health Insurance Portability and Accountability Act.
41040|hipberries|hip′ber′ēz|
25552|Hippel disease|hip′el|
41041|Hippelates|hip′ĕ-lā′tēz|The eye gnats, a genus of flies in the family Chloropidae (fruit flies) that are attracted to the bodily secretions and fluids of animals and humans, particularly those in the eyes. Hippelates is suspected of transmitting certain types of conjunctivitis (such as pinkeye), bovine mastitis, and yaws (frambesia tropica).
41042|Hippobosca|hip′ō-bos′kă|A genus of pupiparous louse flies (family Hippoboscidae) related to the tsetse flies; they are ectoparasites on birds and mammals.
41043|hippocampal|hip′ō-kam′păl|Relating to the hippocampus.
19272|hippocampal commissure||
20215|hippocampal convolution||
33552|hippocampal fissure||
38891|hippocampal gyrus||
80239|hippocampal sclerosis||a loss of cortical neurons and a reactive astrocytosis in the hippocampal regions of some persons with epilepsy.
86367|hippocampal sulcus||a shallow groove between the dentate gyrus and the parahippocampal gyrus; the remains of a fissure extending deep into the hippocampus between the Ammon horn and the dentate gyrus, which becomes obliterated during fetal development.
41044|hippocampus|hip′ō-kam′pŭs|The complex, internally convoluted structure that forms the medial margin (“hem”) of the cortical mantle of the cerebral hemisphere, bordering the choroid fissure of the lateral ventricle, and composed of two gyri (Ammon horn and the dentate gyrus), together with their white matter, the alveus and fimbria hippocampi. In monkeys, apes, and humans, the hippocampus is confined to the temporal lobe by the massive development of the corpus callosum. Cytoarchitecturally a unique form of allocortex (archicortex), the hippocampus forms part of the limbic system (formerly rhinencephalon). Its major afferent connections are with the entorhinal area of the parahippocampal gyrus and with the transparent septum; by way of the fornix, it projects to the septum, anterior nucleus of the thalamus, and mammillary body.
41045|hippocampus major||
41047|hippocampus minor||
41049|Hippocrates of Cos|hip-ok′ră-tēz kas|Greek physician, called the “Father of Medicine,” circa 460–377 B.C.
41050|hippocratic|hip′ō-krat′ik|Relating to, described by, or attributed to Hippocrates.
31327|hippocratic face||
31486|hippocratic facies||a pinched expression of the face, with sunken eyes, concavity of cheeks and temples, relaxed lips, and leaden complexion; observed in one close to death after severe and prolonged illness.
33421|hippocratic fingers||
58731|hippocratic nails|hip-ō-krat′ik|the coarse, curved nails capping clubbed digits.
41051|Hippocratic Oath|hip′ō-krat′ik ōth|An oath taken by physicians usually on receiving the doctoral degree, whereby they promise to observe ethical principles in the practice of medicine. The oath is named for Hippocrates of Cos (470–380 bce), who belonged to the medical guild or brotherhood of sclepiads and is honored as the Father of Medicine because he first separated the art and science of medicine from philosophy and religion. But although the oath survives among the numerous and various writings composing the hippocratic corpus, modern scholars doubt that it was the work of Hippocrates himself. Its prohibition of suicide, euthanasia, abortion, and surgery (all of which were accepted or condoned among the Asclepiads) suggests rather a Pythagorean origin. The date of its composition and the original manner of its use are unknown.
80090|hippocratic school||the followers of the teachings of Hippocrates.
86178|hippocratic succussion||a splashing noise produced by shaking the body when there is gas or air and fluid in the stomach or intestine, or free in the peritoneum, thorax, and, rarely, the pericardium.
83004|hippocratic succussion sound||
41052|hippocratism|hi-pok′ră-tizm|A system of medicine, attributed to Hippocrates and his disciples, based on the imitation of nature's processes in the therapeutic management of disease.
41054|hippurate|hip′yū-rāt|A salt or ester of hippuric acid.
41055|hippuria|hi-pyū′rē-ă|The excretion of an abnormally large amount of hippuric acid in the urine.
41056|hippuric acid|hi-pyūr′ik as′id|A detoxification and excretory product of benzoate found in the urine of humans and many herbivorous animals; used therapeutically in the form of its salts (hippurates of calcium and ammonium).
41057|hippuricase|hi-pyūr′i-kās|
41058|hippus|hip′ŭs|Intermittent pupillary dilation and constriction, independent of illumination, convergence, or psychic stimuli.
41060|hirci|hĕr′si|Plural of hircus.
41061|hircismus|hĭr-siz′mŭs|Offensive odor of the axillae.
41062|hircus|hĭr′kŭs, hĕr′sī|The odor of the axillae.
84390|Hirsch-Peiffer stain|hĭrsh′ pīf′ĕr|a stain used for cytologic demonstration staining of metachromatic leukodystrophy; excess sulfatides stain metachromatically (golden brown) with cresyl violet in acetic acid.
41065|Hirsch-Peiffer stain|hĭrsh′ pīf′ĕr|
41063|Hirschberg|hĭrsh′bĕrg|Julius, German ophthalmologist, 1843–1925.
54811|Hirschberg method|hĭrsh′bĕrg|
90572|Hirschberg test|hĭrsh′bĕrg|a test of binocular motor alignment by which a penlight is shone at the eyes and the position of the light reflex on the cornea observed, allowing an estimate of the amount of deviation, if present.
41064|Hirschfeld|hĭrsh′feld|Isador, U.S. dentist, 1881–1965.
13647|Hirschfeld canals|hĭrsh′feld|
41066|Hirschsprung|hĭrsh′sprūng|Harald, Danish physician, 1830–1916.
25553|Hirschsprung disease|hĭrsh′sprūng|
41067|hirsute|hĭr-sūt′|Relating to or characterized by hirsutism.
41068|hirsuties|hĭr-su′tē-ēz|
41069|hirsutism|hĭr′sū-tizm|Presence of excessive bodily and facial hair, usually in a male pattern, especially in women; may be present in normal adults as an expression of an ethnic characteristic or may develop in children or adults as the result of androgen excess due to tumors, or of nonandrogenetic or other drugs.
41072|hirtellous|hĭr′tĕ-lŭs|Having or resembling fine hairs; term describing the filamentous protein polysaccharide coating of microvilli.
41073|hirudicide|hi-rū′di-sīd|An agent that kills leeches.
41074|hirudin|hir′ū-din|An antithrombin substance extracted from the salivary glands of the leech that has the property of preventing coagulation of the blood.
41075|Hirudinea|hir′ū-din′ē-ă|The leeches, a class of worms (phylum Annelida) with flat, segmented bodies, a sucker at the posterior end, and often a smaller sucker at the anterior end; they are predatory on invertebrate tissues, or feed on blood and tissue exudates of vertebrates.
41076|hirudiniasis|hir′ū-di-nī′ă-sis|A condition resulting from leeches, attaching themselves to the skin or being taken into the mouth or nose while drinking.
41077|hirudinization|hi-rū′di-nī-zā′shŭn|The process of rendering the blood noncoagulable by the injection of hirudin.&#&The application of leeches.
41078|Hirudo|hi-rū′dō|A genus of leeches (class Hirudinea, family Gnathobdellidae). Species previously used in medicine are: Hirudo australis, Australian leech; Hirudo decora, American leech; Hirudo interrupta or Hirudo troctina, a North African leech; Hirudo medicinalis, speckled, Swedish, or German leech, the species previously in most general use; Hirudo m. officinalis, a variety of the preceding; Hirudo provincialis, the green or Hungarian leech; Hirudo quinquestriata, five-striped leech.
41079|hirulog|her-yū-log|A synthetic thrombin inhibitor.
41081|His|hiz|Wilhelm, Sr., Swiss anatomist and embryologist in Germany, 1831–1904.
41080|His|hiz|Wilhelm, Jr., German physician, 1863–1934.
41084|His|hiz|Symbol for histidine.
9379|His band|hiz|
12781|His bundle|hiz|
28294|His bundle electrogram (HBE)|hiz|an electrogram recorded from the His bundle, either in the experimental animal or in humans during electrophysiologic cardiac catheterization.
20326|His copula|hiz|
50403|His line|hiz|a line extending from the tip of the anterior nasal spine (acanthion) to the hindmost point on the posterior margin of the foramen magnum (opisthion), dividing the face into an upper and a lower, or dental part.
83091|His perivascular space|hiz|
83743|His spindle|hiz|
89304|His-Tawara system|hiz tă-wah′ră|the complex system of interlacing Purkinje fibers within the ventricular myocardium.
41082|His—||Symbol for histidyl.
41085|Hiss|his|Philip, U.S. bacteriologist, 1868–1913.
84391|Hiss stain|his|a stain for demonstrating the capsules of microorganisms, using gentian violet or basic fuchsin followed by a copper sulfate wash.
41086|histaminase|his-tam′i-nās|
41087|histamine (H)|his′tă-mēn|A vasodepressor amine derived from histidine by histidine decarboxylase and present in ergot and in animal tissues. It is a powerful stimulant of gastric secretion, a constrictor of bronchial smooth muscle, and a vasodilator (capillaries and arterioles) that causes a fall in blood pressure. Histamine, or a substance indistinguishable in action from it, is liberated in the skin as a result of injury. When injected intradermally in high dilution, it causes the triple response.
34185|histamine flush||vasodilation and erythema occurring as a result of release of histamine; thought to be a factor in genesis of flush of carcinoid syndrome.
49286|histamine liberators||substances that cause the release of histamine from mast cells or basophils.
41088|histamine phosphate||used to assess nonspecific bronchial hypersensitivity and as a positive control during skin testing for allergies; also available as histamine acid phosphate.
81569|histamine shock||the shock state produced in animals by the injection of histamine; characterized by bronchiolar spasm in the guinea pig and constriction of hepatic veins in the dog.
90573|histamine test||a test for maximal production of gastric acidity or anacidity; after preliminary administration of an antihistamine, histamine acid phosphate is injected subcutaneously in a dose of 0.04 mg/kg of body weight, followed by analysis of gastric contents.
41089|histamine-fast|his′tă-mēn fast|Indicating the absence of the normal response to histamine, especially in speaking of true gastric anacidity.
31694|histamine-releasing factor||a cytokine produced from antigen-stimulated lymphocytes that induces the release of histamine from basophils.
41090|histaminemia|his′tă-mi-nē′mē-ă|The presence of histamine in the circulating blood.
16189|histaminic cephalalgia||
39417|histaminic headache||
41091|histaminuria|his′tă-mi-nyū′rē-ă|The excretion of histamine in the urine.
41092|histangic|his-tan′jik|
41093|histidase|his′ti-dās|
41094|histidinal|his′ti-din′ăl|The aldehyde analogue of histidine (–CHO replacing –COOH).
41095|histidinase|his′ti-di-nās|
41096|histidine (H, His)|his′ti-dēn|the l-isomer is a basic amino acid found in most proteins. It is a nutritionally essential amino acid in mammals.
2868|histidine aminotransferase||an enzyme that catalyzes the reversible reaction of l-histidine with α-ketoglutarate to produce imidzol-5-yl-pyruvate and l-glutamate.
41097|histidine ammonia-lyase||an enzyme catalyzing deamination of l-histidine to urocanate and ammonia; this enzyme is absent or deficient in people with histidinemia.
41098|histidine deaminase||
41099|histidine decarboxylase||an enzyme catalyzing the pyridoxal-phosphate-dependent decarboxylation of l-histidine to histamine and CO₂; thus, it plays a role in constriction of bronchial smooth muscle.
41100|histidinemia|his′ti-di-nē′mē-ă|A metabolic disorder characterized by speech defects, growth deficiency, and mild mental retardation in some patients; associated with elevation of blood histidine level and excretion of histidine and related imidazole metabolites in urine due to deficiency of histidine ammonia lyase or histidinase; autosomal recessive inheritance, caused by mutation in the histidinase gene (HIS) on chromosome 12q.
41101|histidino (—His)|his′ti-din-ō|The radical of histidine produced by removal of a hydrogen from a nitrogen atom; prefixed by Nα, Nτ, or Nπ.
41102|histidinol|his′ti-di-nol|The alcohol analogue of histidine (–COOH becomes –CH₂OH).
41103|histidinuria|his′ti-di-nyū′rē-ă|Excretion of considerable amounts of histidine in the urine; frequently observed in later months of pregnancy, and in histidinemia.
41104|histidyl (His—)|his′ti-dil|The acyl radical of histidine.
41105|histio-|his′tē-ō|Tissue, especially connective tissue.
41106|histioblast|his′tē-ō-blast′|A tissue-forming cell.
41107|histiocyte|his′tē-ō-sīt′|A tissue macrophage; the class includes hepatic Kupffer cells, alveolar macrophages, giant cells of granulomas, osteoclasts, and dermal Langerhans cells. These cells derive from precursors that normally reside in bone marrow but migrate through the bloodstream to egress into tissues for final differentiation.
41110|histiocytoma|his′tē-ō-sī-tō′mă|A tumor composed of histiocytes.
41114|histiocytosis|his′tē-ō-sī-tō′sis|A generalized proliferation of histiocytes.
41121|histiocytosis X||
41122|histiocytosis Y||
41123|histiogenic|his′tē-ō-jen′ik|
41124|histioid|his′tē-oyd|
41125|histioma|his′tē-ō′mă|
41126|histionic|his′tē-on′ik|Relating to any tissue.
41127|histo-|his′tō|Tissue.
41128|histoangic|his′tō-an′jik|Relating to the structure of blood vessels, especially in terms of their function.
41129|histoblast|his′tō-blast|
41130|histochemistry|his′tō-kem′is-trē|
41131|histocompatibility|his′tō-kom-pat′i-bil′i-tē|A state of immunologic similarity (or identity) that permits successful homograft transplantation.
4885|histocompatibility antigen||an antigen on the surface of nucleated cells, particularly leucocytes and thrombocytes.
19427|histocompatibility complex||a family of 50 or more genes on the sixth human chromosome that encodes cell surface proteins and play a role in the immune response.
36644|histocompatibility gene||in laboratory animals, a gene that can elicit an immune response and thereby cause rejection of a homograft when tissue is transplanted from one individual to another; in humans, histocompatibility genes control HLA antigens.
90941|histocompatibility testing||a testing system for HLAs, of major importance in transplantation.
41132|histocyte|his′tō-sīt|
41133|histocytosis|his′tō-sī-tō′sis|
41134|histodifferentiation|his′tō-dif′ĕr-en-shē-ā′shŭn|The morphologic appearance of tissue characteristics during development.
41135|histofluorescence|his′tō-flōr-es′ens|Fluorescence of the tissues under exposure to ultraviolet rays following the injection of a fluorescent substance or as a result of a natural fluorescing substance.
41136|histogenesis|his′tō-jen′ĕ-sis|The origin of a tissue; the formation and development of the tissues of the body.
41137|histogenetic|his′tō-jĕ-net′ik|Relating to histogenesis.
41138|histogenous|his-toj′ĕ-nŭs|Formed by the tissues; the histogenous cells in an exudate arising from proliferation of the fixed tissue cells.
41139|histogeny|his-toj′ĕ-nē|
41140|histogram|his′tō-gram|A graphic columnar or bar representation to compare the magnitudes of frequencies or numbers of items.&#&Graphic representation of the frequency distribution of a variable, in which rectangles are drawn with their bases on a uniform linear scale representing intervals, and their heights are proportional to the values within each of the intervals.
41141|histoid|his′toyd|Resembling in structure one of the tissues of the body.&#&Sometimes used with reference to the histologic structure of a neoplasm derived from and consisting of a single, relatively simple type of neoplastic tissue that closely resembles the normal, as in certain fibromas and leiomyomas.
48863|histoid leprosy||a form of lepromatous leprosy with lesions microscopically resembling dermatofibroma or other spindle-celled tumors.
59118|histoid neoplasm||older term for a neoplasm characterized by a cytohistologic pattern that closely resembles the tissue from which the neoplastic cells are derived.
94890|histoid tumor||old term for a tumor composed of a single type of differentiated tissue.
41142|histoincompatibility|his′tō-in′kom-pat′i-bil′i-tē|A state of immunologic dissimilarity of tissues sufficient to cause rejection of a homograft when tissue is transplanted from one person to another; implies a difference in histocompatibility genes in donor and recipient.
41143|histologic|his′tō-loj′ik, i-kăl|Pertaining to histology.
454|histologic accommodation||change in shape of cells to meet altered physical conditions, as the flattening of cuboidal cells in cysts as a result of pressure.
63506|histological internal os of uterus||site of transition of mucosa of uterus (endometrium) to that of the cervix; it may or may not correspond to the anatomic internal os.
41144|histologist|his-tol′ŏ-jist|One who specializes in the science of histology.
41145|histology|his-tol′ŏ-jē|The science concerned with the minute structure of cells, tissues, and organs in relation to their function.
41147|histolysis|his-tol′i-sis|Disintegration of tissue.
41148|histoma|his-tō′mă|A benign neoplasm in which the cytologic and histologic elements are closely similar to those of normal tissue from which the neoplastic cells are derived.
41149|histometaplastic|his′tō-met′ă-plas′tik|Exciting tissue metaplasia.
41150|histomorphometry|his′tō-mōr-fom′ĕ-trē|The quantitative measurement and characterization of microscopical images using a computer; manual or automated digital image analysis typically involves measurements and comparisons of selected geometric areas, perimeters, length angle of orientation, form factors, center of gravity coordinates, as well as image enhancement.
41151|histone (H)|his′tōn|One of a number of simple proteins (often found in the cell nucleus); contains a high proportion of basic amino acids; soluble in water, dilute acids, and alkalies; and not coagulable by heat; the proteins associated with nucleic acids in the nuclei of plant and animal tissues. They constitute about half the mass of the chromosomes of eukaryotic cells.
41152|histonectomy|his′tō-nek′tŏ-mē|
41153|histoneurology|his′tō-nū-rol′ŏ-jē|
41154|histonomy|his-ton′ŏ-mē|A law of the development and structure of the tissues of the body.
41155|histonuria|his′tō-nyū′rē-ă|The excretion of histone in the urine, as observed in certain instances of leukemia, febrile illnesses, and wasting diseases.
41156|histopathogenesis|his′tō-path′ō-jen′ĕ-sis|Abnormal embryonic development or growth of tissue.
41157|histopathology|his′tō-pă-thol′ŏ-jē|The science or study dealing with the cytologic and histologic structure of abnormal or diseased tissue.
41158|histophysiology|his′tō-fiz′ē-ol′ŏ-jē|The microscopic study of tissues in relation to their functions.
