34998|hyaloid fossa||a depression on the anterior surface of the vitreous body in which lies the lens.
53923|hyaloid membrane||
23308|hyaloideoretinal degeneration||progressive liquefaction and destruction of the vitreous humor with grayish-white preretinal membranes, myopia, cataract, retinal detachment, and hyper- and hypopigmentation; autosomal dominant inheritance.
41762|hyalomere|hī′ă-lō-mēr′|The clear periphery of a blood platelet.
41763|Hyalomma|hī′ă-lom′ă|An Old World genus (about 21 species) of large ixodid ticks with submarginal eyes, coalesced festoons, an ornate scutum, and a long rostrum. Adults parasitize all domestic animals and a wide variety of wild animals; larvae or nymphs may parasitize small mammals, birds, and reptiles. Species harbor a great variety of pathogens of humans and animals, and also cause considerable mechanical injury.
41764|Hyalomma anatolicum||former name for Hyalomma anatolicum anatolicum.
41765|Hyalomma anatolicum anatolicum||a subspecies infesting cattle, camels, and horses in Asia, the Near and Middle East, southeastern Europe, and North Africa; it is a vector of bovine tropical theileriosis, of equine babesiosis, and of human Crimean-Congo hemorrhagic fever.
41766|Hyalomma marginatum||a particularly common species of tick carried by birds migrating between Europe and Asia and Africa, and the probable vector of the virus of Crimean hemorrhagic fever.
41767|Hyalomma variegatum||species of tick that is the vector of the viral agent of lymphocytic choriomeningitis in Ethiopia.
41768|hyalophagia|hī′ă-lō-fā′jē-ă, hī-ă-lof′ă-jē|The eating or chewing of glass.
41769|hyalophobia|hī′ă-lō-fō′bē-ă|Morbid fear of glass objects.
41770|hyaloplasm|hī′ă-lō-plazm′, -plaz′mă|The protoplasmic fluid substance of a cell.
41772|hyaloserositis|hī′ă-lō-sē′rō-sī′tis|Inflammation of a serous membrane with a fibrinous exudate that eventually becomes hyalinized, resulting in a relatively thick, dense, opaque, glistening, white or gray-white coating; when the process involves the visceral serous membranes of various organs, the grossly apparent condition is sometimes colloquially termed icing liver, sugar-coated spleen, frosted heart, and so on, depending on the site.
41773|hyalosis|hī′ă-lō′sis|Degenerative changes in the vitreous body.
41776|hyalosome|hī-al′ō-sōm|An oval or round structure within a cell nucleus that stains faintly but otherwise resembles a nucleolus.
41777|hyalurate|hī′ă-lū′rāt|
41778|hyaluronate|hī′ă-lū′rō-nāt|A salt or ester of hyaluronic acid.
41779|hyaluronate lyase||a lyase that catalyzes the cleavage of hyaluronic acids, producing a number of 3-(4-deoxy-β-d-gluc-4-enuronosyl)-N-acetyl-d-glucosamines (hyalobiuronic acid).
41780|hyaluronic acid|hī′ă-lū-ron′ik as′id|A mucopolysaccharide consisting of alternating β1,4-linked residues of hyalobiuronic acid, forming a gelatinous material in the tissue spaces and acting as a lubricant and shock absorbant generally throughout the body; it is hydrolyzed to disaccharide or tetrasaccharide units by hyaluronidase.
41781|hyaluronic lyase|hī′ă-lū-ron′ik lī′ās|
41782|hyaluronidase|hī′ă-lū-ron′i-dās|Term applied loosely to hyaluronate lyase, hyaluronoglucosaminidase, and hyaluronoglucuronidase, one or more of which are present in sperm, the testes, and other organs, bee and snake venoms, type II pneumonococci, and certain hemolytic streptococci.&#&A soluble enzyme product prepared from mammalian testes; it is used to increase the effect of local anesthetics and to permit wider infiltration of subcutaneously administered fluids, is suggested in the treatment of certain forms of arthritis to promote resolution of redundant tissue, is used to speed the resorption of traumatic or postoperative edema and hematoma, is used in combination with collagenase to dissociate organs, such as liver and heart, into viable cell suspensions, and in histochemistry is used on tissue secretions to verify the presence of hyaluronic acid or chondroitin sulfates.
41783|hyaluronoglucosaminidase|hī′ă-lū-ron′ō-glū′kō-să-min′i-dās|An enzyme that catalyzes the hydrolysis of β1,4 linkages in hyaluronates.
41784|hyaluronoglucuronidase|hī′ă-lū-ron′ō-glū-ku-ron′i-dās|An enzyme that catalyzes the hydrolysis of β1,3 linkages in hyaluronates.
41785|hybaroxia|hī′bă-rok′sē-ă|Oxygen therapy with pressures greater than 1 atmosphere or ambient oxygen pressure applied to the entire body in a chamber or room.
41786|hybrid|hī′brid|An individual (plant or animal) with parents that are different varieties of the same species or belong to different but closely allied species.&#&Fused tissue culture cells, as in a hybridoma.&#&A bond or valence orbital obtained by the linear combination of two or more different atomic orbitals.
72895|hybrid prosthesis||
78101|hybrid revascularization|hī′brid rē-vas′kyū-lăr-i-zā′shŭn|combination of percutaneous transluminal coronary angioplasty and a surgical procedure for coronary vascular disease.
41789|hybridism|hī′brid-izm|The state of being hybrid.
41790|hybridization|hī′brid-i-zā′shŭn|The process of breeding a hybrid.&#&Crossing over between related but nonallelic genes.&#&The specific reassociation of complementary strands of polynucleic acids, the formation of a DNA-RNA hybrid.&#&The process or act of forming a macromolecular hybrid in which the subunits are obtained from different sources.
41803|hybridoma|hī′brid-ō′mă|A tumor of hybrid cells used in the in vitro production of specific monoclonal antibodies; produced by fusion of an established tissue culture line of lymphocyte tumor cells (mouse plasmacytoma cells) and specific antibody–producing cells (splenocytes from specifically immunized mice). Fusions are accomplished by use of polyethylene glycol or other methods.
41804|hydantoin|hī-dan′tō-in|derived from urea or from allantoin; the NH–CH₂–CO group is prototypical of α-amino acids. Hydantoin derivatives are formed by the reaction of phenylisothiocyanate or phenylisocyanate and a polypeptide.
41805|hydantoinate|hī′dan-tō′in-āt|A salt of hydantoin.
41806|hydatid|hī′da-tid|A vesicular structure resembling an Echinococcus cyst.
22387|hydatid cyst||a cyst formed in the liver, or, less frequently, elsewhere, by the larval stage of Echinococcus, chiefly in ruminants; two morphologic forms caused by Echinococcus granulosus are found in humans: the unilocular hydatid cyst and the osseous hydatid cyst; a third form in humans is the alveolar hydatid cyst, caused by Echinococcus multilocularis.
25563|hydatid disease||infection of humans, sheep, and most other herbivorous and omnivorous mammals with larvae of the tapeworm Echinococcus cyst; frequently found in the liver.
35483|hydatid fremitus||
71012|hydatid polyp||
71794|hydatid pregnancy||the presence of a hydatiform mole in the pregnant uterus.
75839|hydatid rash||a toxic eruption occasionally following the rupture of a hydatid cyst.
77605|hydatid resonance||a peculiar vibratile resonance heard on auscultatory percussion over a hydatid cyst.
79573|hydatid sand||the scoleces, daughter cysts, hooks, and calcareous corpuscles of Echinococcus tapeworms in the fluid within a primary or daughter hydatid cyst.
91773|hydatid thrill||the peculiar trembling or vibratory sensation felt on palpation of a hydatid cyst.
41812|hydatidiform|hī′da-tid′i-form|Having the form or appearance of a hydatid.
55723|hydatidiform mole||a vesicular or polycystic mass resulting from the proliferation of the trophoblast, with hydropic degeneration and avascularity of the chorionic villi; the abnormal tissue typically results from expression of paternally derived chromosomes and a loss of maternal chromosomes.
41813|hydatidocele|hī′da-tid′ō-sēl|A cystic mass composed of one or more hydatids formed in the scrotum.
41814|hydatidosis|hī′da-ti-dō′sis|The morbid state caused by the presence of hydatid cysts.
41815|hydatidostomy|hī′da-ti-dos′tŏ-mē|Surgical evacuation of a hydatid cyst.
41816|Hydatigera taeniaeformis|hī′da-tij′ĕr-ă tē′ni-ē-fōr′mis|
41817|hydatoid|hī′da-toyd|The aqueous humor.&#&The hyaloid membrane.&#&Relating to the aqueous humor.&#&Watery or resembling water.
41818|hydnocarpus oil|hid′nō-kar′pŭs as′id|
41819|hydr-||
41820|hydracetin|hī-dras′ĕ-tin|Pure form of acetylphenylhydrazine.
41821|hydradenitis|hī′drad-ĕ-nī′tis|
41822|hydradenoma|hī′drad-ĕ-nō′mă|
41823|hydragogue|hī′dră-gog|Producing a discharge of watery fluid; denoting a class of cathartics that retain fluids in the intestine and aid in the removal of edematous fluids, saline cathartics.
88107|hydralazine syndrome||
41824|hydrallostane|hī-dral′ō-stān|a metabolite of cortisol, reduced at the 4,5 double bond.
41825|hydramnios|hī-dram′nē-os, -nē-on|Presence of an excessive amount of amniotic fluid, usually over 2,000 mL.
41826|hydranencephaly|hī′dran-en-sef′ă-lē|Absence of cereberal hemispheres, which have been replaced by fluid-filled sacs, lined by leptomeninges. The cranium and its brain cavities, however, are normal.
41827|hydrargyria|hī′drar-jir′ē-ă, hī-drar′jir-izm|
41828|hydrargyrum|hī-drar′ji-rŭm|
41829|hydrarthrodial|hī′drar-thrō′dē-ăl|Relating to hydrarthrosis.
41830|hydrarthrosis|hī′drar-thrō′sis|Effusion of a serous fluid into a joint cavity.
41832|hydrase|hī′drās|Former name for hydratase.
41833|hydrastine|hī-dras′tēn|An alkaloid of hydrastis; an isoquinoline chemically related to narcotine. (+) hydrastine is a GABA₁₄ antagonist and convulsant.
41834|hydrastinine|hī-dras′ti-nēn|A semisynthetic alkaloid prepared from hydrastine; the hydrochloride has been used in uterine hemorrhage and as an oxytocic; in large doses, it is a powerful depressant of the entire motor system (motor cortex, nerve, and muscle).
41835|hydrastis|hī-dras′tis|The dried rhizome of Hydrastis canadensis (family Ranunculaceae), native to eastern U.S.; formerly used to treat chronic catarrhal states of the mucous membranes and in metrorrhagia.
41836|hydratase|hī′dră-tās|Trivial name applied, together with dehydratase, to certain hydro-lyases that catalyzes hydration-dehydration, fumarate-malate interconversion by fumarate hydratase.
41837|hydrate|hī′drāt|An aqueous solvate (in older terminology, a hydroxide); a compound that crystallizes with one or more molecules of water, CuSO₄·5H₂O.
21732|hydrate crystal||one of several possible microstructural arrangements of water molecules based on intermolecular forces; suggested as being involved in the mode of action of inhalation anesthetics.
91254|hydrate microcrystal theory of anesthesia||a theory of narcosis pertaining to nonhydrogen-bonding agents; postulates the interaction of the molecules of the anesthetic drug with water molecules in the brain.
41838|hydrated|hī′drāt-ĕd|Combined with water, forming a hydrate.
2540|hydrated alumina||
41839|hydration|hī-drā′shŭn|Chemically, the addition of water; differentiated from hydrolysis, where the union with water is accompanied by a splitting of the original molecule and the water molecule.&#&Clinically, the taking in of water; used commonly in the sense of reduced hydration or dehydration.&#&The formation of a shell of water molecules around a molecular entity.
19703|hydraulic conductivity||ease of pressure filtration of a liquid through a membrane; specifically, Kf = η(Q/A) (΄x/΄P), where Kf = hydraulic conductivity, η = viscosity of the liquid being filtered, Q/A = volume of liquid filtered per unit time and unit area, and ΄x/΄P = reciprocal of the pressure gradient through the membrane; solute concentrations should be identical on both sides of the membrane. Also applied more loosely to measurements on a total membrane of unknown area and thickness with unmeasured fluid viscosity (K = Q/΄P).
41841|hydrazide|hī′dră-zīd|An organic compound of the general formula RCO–NHNH₂; an acyl derivative of hydrazine.
41842|hydrazine|hī′dră-zēn|H₂N–NH₂, an oily liquid from which phenylhydrazine and similar products are derived. It is very toxic and possibly a carcinogen.
41843|hydrazine yellow|hī′dră-zēn yel′ō|
41844|hydrazinolysis|hī′dră-zi-nol′i-sis|Cleavage of chemical bonds by hydrazine; applied in protein and nucleic acid degradations.
41845|hydrazone|hī′dră-zōn|A substance derived from aldehydes and ketones by reaction with hydrazine or a hydrazine derivative to give the grouping R′R″C=N—NHR.
41846|hydremia|hī-drē′mē-ă|A condition in which the blood volume is increased as a result of an increase in the water content of plasma, with or without a reduction in the concentration of protein; there is an excess of plasma in proportion to the cellular elements and a corresponding decrease in hematocrit.
27933|hydremic edema||obsolete term for edema occurring in states marked by pronounced hydremia.
41847|hydrencephalocele|hī′dren-sef′ă-lō-sēl|Protrusion, through a cleft in the cranium, of brain substance expanded into a sac that contains fluid.
41848|hydrencephalomeningocele|hī′dren-sef′ă-lō-me-ning′gō-sēl|Protrusion, through a defect in the cranium, of a sac containing meninges, brain substance, and cerebrospinal fluid.
41849|hydrencephalus|hī′dren-sef′ă-lŭs|Rarely used term for internal hydrocephalus.
41850|hydriatric|hī′drē-at′rik, -at′ik|Relating to an obsolete use of water to treat or cure disease.
41851|hydric|hī′drik|Relating to hydrogen in chemical combination.
41852|hydride|hī′drīd|A negatively charged hydrogen (H:−) or a compound of hydrogen in which it assumes a formal negative charge, sodium borohydride (NaBH₄).
45587|hydride ion||the H− i., transferred to acceptor molecules in some biologic oxidations.
41853|hydrindantin|hī′drin-dan′tin|The reduced form of ninhydrin. It is often used in conjunction with ninhydrin in the detection of amino or imino groups.
41854|hydro-|hī′drō|Prefix denoting the presence of water or watery fluid or of hydrogen.&#&A hydatid.
41855|hydroa|hī-drō′ă|Any vesicular or bullous eruption.
41856|hydroa aestivale||
41857|hydroa puerorum||
41858|hydroa vacciniforme||a recurrent eruption of erythema evolving to umbilicated bullae, occurring on exposure to the sun and affecting chiefly male children with resolution before adult life. In severe cases, hand and face deformities and corneal opacity may develop.
41859|hydroadipsia|hī′drō-ă-dip′sē-ă|Absence of thirst for water.
31141|hydroalcoholic extract||a solid extract obtained by extracting the soluble principles of the drug with alcohol and water, followed by evaporation of the solution.
92154|hydroalcoholic tincture||a tincture made with diluted alcohol in various proportions with water.
41860|hydroappendix|hī′drō-ă-pen′diks|Distention of the vermiform appendix with a serous fluid.
41861|hydrobilirubin|hī′drō-bil′i-rū′bin|A dark brown-red pigment that may be formed when bilirubin is reduced.
41862|hydrobromic acid|hī′drō-brō′mik as′id|An aqueous solution of hydrogen bromide (HBr); its salts are bromides.
41863|hydrocalycosis|hī′drō-kal′i-kō′sis|A usually symptomless anomaly of the renal calix that is dilated from obstruction of the infundibulum; usually discovered incidentally at pyelography or autopsy; may become infected.
41864|hydrocarbon|hī′drō-kar′bŏn|A compound containing only hydrogen and carbon.
41867|hydrocele|hī′drō-sēl|A collection of serous fluid in a sacculated cavity; specifically, such a collection in the space of the tunica vaginalis testis, or in a separate pocket along the spermatic cord.
41869|hydrocele colli||
41874|hydrocele feminae||accumulation of serous fluid in the labia majora or in canal of Nuck.
41879|hydrocele spinalis||
41880|hydrocelectomy|hī′drō-sē-lek′tŏ-mē|Excision of a hydrocele by drainage of its fluids and sometimes, partial excision of tunical vaginalis.
41881|hydrocephalic|hī′drō-se-fal′ik|Relating to or suffering from hydrocephalus.
41882|hydrocephalocele|hī′drō-sef′ă-lō-sēl|
41883|hydrocephaloid|hī′drō-sef′ă-loyd|Resembling hydrocephalus.&#&A condition in infants who suffer from diarrhea or other debilitating disease, with dehydration and general symptoms resembling those of hydrocephalus, without, however, any abnormal accumulation of cerebrospinal fluid.
41884|hydrocephalus|hī′drō-sef′ă-lŭs|A condition marked by an excessive accumulation of cerebrospinal fluid resulting in dilation of the cerebral ventricles and raised intracranial pressure; may also result in enlargement of the cranium and atrophy of the brain.
41889|hydrocephalus ex vacuo||hydrocephalus due to loss or atrophy of brain tissue; less commonly associated with raised intracranial pressure.
41902|hydrocephaly|hī′drō-sef′ă-lē|
41903|hydrochloric acid (HCl)|hī′drō-klōr′ik as′id|Acid of gastric juice. The commercial product is used as an escharotic; the gas and the concentrated solution are strong irritants.
41905|hydrochloride|hī′drō-klōr′īd|A compound formed by the addition of a hydrochloric acid molecule to a basic moiety on the substance, guanine hydrochloride, glycine hydrochloride.
41906|hydrochlorothiazide|hī′drō-klōr′ō-thī′ă-zīd|A potent orally effective diuretic and antihypertensive agent related to chlorothiazide; can cause hypokalemia and hyperglycemia.
41907|hydrocholecystis|hī′drō-kō′lē-sis′tis|Rarely used term for an effusion of serous fluid into the gallbladder.
41908|hydrocholeresis|hī′drō-kō′lĕ-rē′sis, -kol-ĕr-|Increased output of a watery bile of low specific gravity, viscosity, and solid content.
41909|hydrocholeretic|hī′drō-kō′lĕ-ret′ik|Pertaining to hydrocholeresis.
41910|hydrocodone|hī′drō-kō′dōn|A potent analgesic derivative of codeine used as an antitussive and analgesic. Often used combined with aspirin or acetaminophen.
41911|hydrocolloid|hī′drō-kol′oyd|A gelatinous colloid in unstable equilibrium with its contained water, useful in dentistry for impressions because of its dimensional stability under controlled conditions.
41914|hydrocolpocele|hī′drō-kol′pō-sēl, -kol′pos|Accumulation of mucus or other nonsanguineous fluid in the vagina.
41915|hydrocortamate hydrochloride|hī-drō-kōr′tă-māt hī′drō-klōr′īd|An ester-salt of hydrocortisone, used topically in the treatment of acute and chronic dermatoses.
41916|hydrocortisone|hī′drō-kōr′ti-sōn|The principal glucocorticoid produced by the adrenal cortex. Although synthetic products used medicinally are usually known by this name, the natural hormone is more often called cortisol.
41917|hydrocotarnine|hī′drō-kō-tar′nēn|An alkaloidal principle derived from cotarnine; it is the basic hydrolytic product of narcotine; also obtained from the mother liquors of thebaine.
41918|hydrocyanic acid (HCN)|hī′drō-sī-an′ik as′id|A colorless, toxic liquid, with the odor of bitter almonds, present in bitter almonds (amygdalin), the stones of peaches, plums, and other drupes, and laurel leaves; inhalation of 300 ppm causes death.
41919|hydrocyanism|hī′drō-sī′an-izm|Poisoning with hydrocyanic acid.
41920|hydrocyst|hī′drō-sist|A cyst with clear, watery contents.
41921|hydrocystoma|hī′drō-sis-tō′mă|An eruption of deeply seated vesicles, due to retention of fluid in the sweat follicles.
41922|hydrodipsia|hī′drō-dip′sē-ă|Water thirst, a characteristic of animals that ordinarily drink water.
41923|hydrodipsomania|hī′drō-dip′sō-mā′nē-ă|Periodic episodes of uncontrollable thirst, occasionally found in epileptic patients.
41924|hydrodiuresis|hī′drō-dī′yū-rē′sis|Diuresis effected by water.
41925|hydrodynamics|hī′drō-dī-nam′iks|The branch of physics concerned with the flow of liquids.
9724|hydroelectric bath||
41926|hydroencephalocele|hī′drō-en-sef′ă-lō-sēl|
41927|hydrofluoric acid|hī′drō-flōr′ik as′id|A solution of hydrogen fluoride gas in water; a poisonous, caustic, foaming liquid that is used to clean metals and can etch glass; extremely irritating to skin and lungs.
41928|hydrogel|hī′drō-jel|A colloid in which the particles are in the external or dispersion phase and water in the internal or dispersed phase.
41929|hydrogen (H)|hī′drō-jen|A gaseous element, atomic no. 1, atomic wt. 1.00794.&#&The molecular form (H₂) of the element.
438|hydrogen acceptor||
11168|hydrogen bond||a bond arising from the sharing of a hydrogen atom, covalently bound to a strongly electronegative element (N, O, or a halogen), with another strongly electronegative element (N, O, or a halogen). In substances of biologic importance, the most common hydrogen bonds are those in which H links N to O or N; such bonds link purines on one strand to pyrimidines on the other strand of nucleic acids, thus maintaining double-stranded structures as in the Watson-Crick helix.
41932|hydrogen bromide||a colorless gas that produces an irritating odor and noxious fumes in moist air; in aqueous solution, it is hydrobromic acid.
14667|hydrogen carrier||a molecule that, in conjunction with a tissue enzyme system, carries hydrogen from one metabolite (oxidant) to another (reductant) or to molecular oxygen to form H₂O.
41933|hydrogen chloride||a highly soluble gas which, in solution, forms hydrochloric acid.
41934|hydrogen cyanide||
41935|hydrogen dehydrogenase||a flavoprotein catalyzing the conversion of NAD⁺ to NADH by molecular hydrogen (H₂); H₂ + NAD⁺ → H⁺ + NADH.
41936|hydrogen dioxide||
26442|hydrogen donor||a metabolite from which hydrogen is removed (by a dehydrogenase system) and transferred by a hydrogen carrier to another metabolite, which is thus reduced.
28263|hydrogen electrode||the ultimate standard of reference in all pH determinations, limited and technically difficult to use, consisting of a piece of spongy platinum black partly immersed in a solution in a small glass tube; the tube above the solution is filled with hydrogen gas that is bubbled through the solution and absorbed by the platinum; the electrode thus measures the potential between H₂ and H⁺, the “standard” potential of which (1 atmosphere, 1 molar) is taken as zero; hence, the hydrogen electrode potential measures [H⁺] or pH.
41948|hydrogen exponent|hī′drō-jen eks-pō′nent|The decadic logarithm of the hydrogen ion concentration in blood or other fluid; its negative value is the pH of that fluid.
45588|hydrogen ion (H⁺)||a hydrogen atom minus its electron and therefore carrying a unit positive charge (a proton); in water, it combines with a water molecule to form hydronium ion, H₅O₂⁺, H₇O₃⁺, etc.
61839|hydrogen number||the quantity of hydrogen that 1 g of fat will absorb; it is a measurement of the amount of unsaturated fatty acids in the fat.
41938|hydrogen peroxide||an unstable compound readily broken down to water and oxygen, a reaction catalyzed by various powdered metals and by the enzyme, catalase; a 3% solution is used as a mild antiseptic for skin and mucous membranes.
41939|hydrogen phosphide||
74090|hydrogen pump||molecular mechanism for acid secretion from gastric parietal cells based on the activity of a H⁺-K⁺-ATPase.
41941|hydrogen sulfide||a colorless, flammable, toxic gas with a familiar “rotten egg” odor, formed in the decomposition of organic matter containing sulfur; used as a reagent, and in the manufacture of chemicals.
93366|hydrogen transport||the transfer of hydrogen from one metabolite (hydrogen donor) to another (hydrogen acceptor) through the action of an enzyme system; the donor is thus oxidized and the acceptor reduced.
41943|hydrogen-1|hī′drō-jen|The common hydrogen-1 isotope, making up 99.985% of the hydrogen-1 atoms occurring in nature.
41944|hydrogen-2|hī′drō-jen|The isotope of hydrogen-2 of atomic wt. 2; the less common stable isotope of hydrogen-2, making up 0.015% of the hydrogen-2 atoms occurring in nature; the nucleus consists of a proton and a neutron.
41945|hydrogen-3|hī′drō-jen|A hydrogen isotope of atomic wt. 3; weakly radioactive, emitting beta particles to become the stable helium-3; half-life, 12.32 years.
41946|hydrogenase|hī′drō-jen-ās, hī-droj′ĕ-nās|Any enzyme that removes a hydride ion (or H:−) from NADH (or NADPH).&#&The enzyme that catalyzes the reaction of 2H⁺ with ferricytochrome or ferredoxin to generate H₂.
41947|hydrogenation|hī′drō-jen-ā′shŭn, hī-droj′ĕ-nā-shŭn|Addition of hydrogen to a compound, especially to an unsaturated fat or fatty acid; thus, soft fats or oils are solidified or “hardened.”
41949|hydrogenlyase|hī′drō-gen-lī′ās|
41950|hydrogenosome|hī-drō′jen′ō-sōm|An ATP and hydrogen producing organelle in anaerobic eukaryocytes, including Trichomonas and Giardia, having a double membrane and thought by some to be a  mitochondrial homologue.
41951|hydrokinetic|hī′drō-ki-net′ik|Pertaining to the motion of fluids and the forces giving rise to such motion.
41952|hydrokinetics|hī′drō-ki-net′iks|That branch of kinetics concerned with fluids in motion.
41953|hydrolabile|hī′drō-lā′bil|Unstable in the presence of water.
41954|hydrolability|hī′drō-lă-bil′i-tē|A state in which the fluid in the tissues readily changes in amount.
41955|hydrolases|hī′drō-lās-ĕz|Enzymes (EC class 3) cleaving substrates with addition of H₂O at the point of cleavage, esterases, phosphatases, nucleases, peptidases.
