95550|un-||Not, akin to L. in- and G. a-, an-.&#&Reversal, removal, release, deprivation.&#&An intensive action.
79018|unarmed rostellum||rostellum lacking hooks.
95551|unawareness|ŭn-ă-wār′nes|State of failure to be cognizant of something.
93308|unbalanced translocation||condition resulting from fertilization of a gamete containing a translocation chromosome by a normal gamete; if this abnormality is compatible with life, the individual would have 46 chromosomes but a segment of the translocation chromosome would be represented three times in each cell and a partial or complete trisomic state would exist.
95553|uncaging|un-kāj′ing|Release of an active molecule from its inert protective enclosure at a chosen locus.
95554|uncal|ŭng′kăl|Denoting or relating to the uncus.
7520|uncal artery||origin: cerebral part of internal carotid artery or occasionally from the sphenoidal part (M1 segment) of the middle cerebral artery; distrubution: to uncus.
40629|uncal herniation||
95555|unci|ŭn′sī|Plural of uncus.
95556|uncia|ŭn′sē-ă|An ounce.
95557|unciform|ŭn′si-fōrm|
11350|unciform bone||
32273|unciform fasciculus||a band of long association fibers reciprocally connecting the frontal and temporal lobes of the cerebrum, running caudally through the white matter of the frontal lobe, sharply curving anterolaterally under the stem of the sylvian fissure, and then fanning out to the cortex of the anterior half of the superior and middle temporal gyri.
95558|unciforme|ŭn′si-fōr′mē|
95559|Uncinaria|ŭn′si-nar′ē-ă|A genus of nematode hookworms that infect various mammals. Species include Uncinaria stenocephala, the European hookworm of dogs, cats, and various wild carnivores, also found in North America, where it is much less common than Ancylostoma caninum, although it has been implicated in human cutaneous larva migrans.
95560|uncinariasis|ŭn′si-nă-rī′ă-sis|
95561|uncinate|ŭn′si-nāt|Hooklike or hook-shaped.&#&Relating to an uncus or, specifically, to the uncinate gyrus (2) or a process of the pancreas or of a vertebra.
8529|uncinate attack||
12815|uncinate bundle of Russell|rŭs′ĕl|
29826|uncinate epilepsy||a form of psychomotor epilepsy or complex partial seizure initiated by a dreamy state and hallucinations of smell and taste, usually the result of a medial temporal lesion.
32274|uncinate fasciculus of cerebellum||fastigial efferent fibers that cross within the cerebellum and descend over the lateral surface of the superior cerebellar peduncle; these fibers largely terminate in the vestibular nuclei and the reticular formation of the pons and medulla.
32275|uncinate fasciculus of Russell|rŭs′ĕl|
33743|uncinate fit||
38954|uncinate gyrus||
64645|uncinate pancreas||
72359|uncinate process of cervical vertebra||raised lateral margins of the superior surface of the cervical vertebrae; with aging they often extend superiorly sufficient to contact the superior vertebra, forming an uncovertebral joint.
72360|uncinate process of ethmoid bone||a sickle-shaped process of bone on the medial wall of the ethmoidal labyrinth below the middle concha; it articulates with the ethmoidal process of the inferior concha and partly closes the orifice of the maxillary sinus.
72361|uncinate process of first thoracic vertebra||raised lateral edge of the superior surface.
72362|uncinate process of pancreas||a portion of the head of the pancreas that hooks around posterior to the superior mesenteric vessels, sometimes into the nutcracker (q.v.) formed by the superior mesenteric artery and abdominal aorta.
95562|uncinatum|ŭn′si-nā′tŭm|
95563|uncipressure|ŭn′si-presh′ŭr|Arrest of hemorrhage from a cut artery by pressure with a blunt hook.
68320|uncleanliness||automysophobia.
95569|unco-ossified|ŭn′kō-os′i-fīd|Not coossified; not united into one bone.
88980|uncombable hair syndrome||a genetic syndrome in which the hair, which is often silvery blond, is unruly and resists lying flat because of irregularly shaped hair shafts.
88337|uncombable hair syndrome||a genetic syndrome in which the hair, which is often silvery blond, is unruly and resists lying flat because of irregularly shaped hair shafts.
49212|uncomfortable level||the intensity of sound that causes discomfort.
705|uncompensated acidosis||an acidosis in which the pH of body fluids is subnormal, because restoration of normal acid-base balance is not possible or has not yet been achieved.
2242|uncompensated alkalosis||alkalosis in which the pH of body fluids is elevated because of lack of the compensatory mechanisms of compensated alkalosis.
44633|uncompetitive inhibition||an inhibitory effect on a metabolic function, such as that of an enzyme, not based on competition for the binding site of the naturally occurring substrate but on a different effect on the molecule the function of which is being inhibited; an uncompetitive inhibition binds only to the enzyme-substrate complex.
44675|uncompetitive inhibitor||a type of enzyme inhibitor in which the inhibiting compound only binds to the enzyme-substrate complex.
95564|uncomplemented|ŭn-kom′plĕ-ment′ĕd|Not united with complement and therefore inactive.
76966|unconditioned reflex||an instinctive reflex not dependent on previous learning or experience.
77716|unconditioned response||a response, such as salivation, which is a part of the animal or human repertoire.
85099|unconditioned stimulus||a stimulus that elicits an unconditioned response; food is an unconditioned stimulus for salivation, which in turn is an unconditioned response in a hungry animal.
10201|unconjugated bilirubin||
95565|unconscious|ŭn-kon′shŭs|Not conscious.&#&In psychoanalysis, the psychic structure comprising the drives and feelings of which one is unaware.
41408|unconscious homosexuality||
54063|unconscious memories||
95568|unconsciousness|ŭn-kon′shŭs-ness|An imprecise term for severely impaired awareness of self and the surrounding environment; most often used as a synonym for coma or unresponsiveness.
95570|uncouplers|ŭn-kŭp′lĕrz|Substances such as dinitrophenol that allow oxidation in mitochondria to proceed without the usual concomitant phosphorylation to produce ATP; these poisons thus “uncouple” oxidation and phosphorylation.
31825|uncoupling factors||
95571|uncovertebral|ŭn′kō-ver′tĕ-brăl|Pertaining to or affecting the uncinate process of a vertebra.
46472|uncovertebral joints||small synovial joints formed secondarily between the lateral lips (uncinate processes) of the superior surfaces of the bodies of the lower cervical vertebrae and the inferior surface of the superior vertebral body.
25104|uncrossed diplopia||
95572|unction|ŭngk′shŭn|The action of anointing or rubbing with an ointment or oil.
95573|unctuous|ŭngk′shū-ŭs, shŭs|Greasy or oily.
95574|uncture|ŭnk′chūr|
95575|uncus|ŭn′kŭs, ŭn′sī|Any hook-shaped process or structure.&#&The anterior, hooked extremity of the parahippocampal gyrus on the basomedial surface of the temporal lobe; the anterior face of the uncus corresponds to the olfactory cortex, its ventral surface to the entorhinal area; deep to the uncus lies the amygdala (amygdaloid body).
9402|uncus band of Giacomini|jah-kō-mē′nē|a slender whitish band, the attenuated anterior continuation of the dentate gyrus (fascia dentata), crossing transversally the surface of the recurved part of the uncus gyri parahippocampalis.
95576|uncus gyri parahippocampalis||
95577|undecenoic acid|ŭn′des-ĕ-nō′ik as′id|
95578|undecoylium chloride-iodine|ŭn′de-kō-il′ē-ŭm klōr′īd-ī′ō-dīn|A complex of iodine with undecoylium chloride; a cationic detergent used topically as a germicidal agent.
95579|undecylenic acid|ŭn′des-i-len′ik as′id|An acid present in small amounts in sweat; used with its zinc salt in ointments, or as a powder.
95580|underachievement|ŭn′dĕr-ă-chēv′mĕnt|
95581|underachiever|ŭn′dĕr-ă-chēv′ĕr|One who manifests underachievement.
95582|underbite|ŭn′dĕr-bīt|A nontechnical term applied to mandibular underdevelopment or to excessive maxillary development.
95583|undercut|ŭn′dĕr-kŭt|That portion of a tooth that lies between the survey line (height of contour) and the gingivae.&#&The contour of a cross-section of a residual ridge or dental arch that would prevent the insertion of a denture.&#&The contour of a flasking stone that interlocks in such a way as to prevent the separation of the parts.
36532|undercut gauge||a device, used with a surveyor, to locate areas for the placement of the retentive components of clasps precisely when designing removable partial dentures.
95584|underdrive pacing|ŭn′dĕr-drīv pās′ing|Electrical stimulation of the heart at a rate lower than that of an existing tachycardia; designed to capture the heart between beats, to interrupt a reentry pathway to terminate the tachycardia.
95464|undermining ulcer||a chronic cutaneous ulcer with overhanging margins; due to hemolytic streptococci, tubercle bacilli, or other bacteria.
95585|undernutrition|ŭn′dĕr-nū-tri′shŭn|A form of malnutrition resulting from a reduced supply of food or from inability to digest, assimilate, and use the necessary nutrients.
95586|undersensing|ŭn′dĕr-sens′ing|Nonsensing of the intracardiac atrial or ventricular depolarization signal by a pacemaker.
95587|undershoot|ŭn′dĕr-shūt|A temporary decrease below the final steady-state value that may occur immediately following the removal of an influence that had been increasing that value, overshoot in a negative direction.
95588|understain|un′dĕr-stān|To stain less deeply than usual.
95589|underventilation|ŭn′dĕr-ven′ti-lā′shŭn|
95590|underwinding|ŭn′dĕr-wīnd′ing|The effect of negative supercoiling on a structure of DNA.
90952|undescended testis||a testis that has not descended into the scrotum; palpable and nonpalpable (impalpable) variants exist.
60533|undetermined nitrogen||the nitrogen of blood, urine, etc., other than urea, uric acid, amino acids, etc., that can be directly estimated; in blood it amounts to about 25 mg per 100 mL.
95591|undifferentiated|ŭn′dif-ĕr-en′shē-āt′ĕd|Not differentiated; primordial, embryonic, immature, or having no special structure or function.
14398|undifferentiated carcinoma of the thyroid||
15946|undifferentiated cell||a primordial cell that has not assumed the morphologic and functional characteristics it will later acquire.
1183|undifferentiated cell adenoma||
32789|undifferentiated type fevers||a term applied to illnesses resulting from infection by any virus, that was formerly in the Arbovirus group, pathogenic for humans, in which the only constant manifestation is fever; rash, lymphadenopathy, or arthralgia (alone or in combination) may occur in some people but not in others; some viruses may induce infections in which undifferentiated type fever is the only manifestation, whereas other viruses may induce in some people only undifferentiated fever, and in others similar fever followed by secondary manifestations, a hemorrhagic fever or encephalitis.
95592|undine|ŭn′dēn, -dīn|A small glass flask that was used in irrigation of the conjunctiva.
95593|undiversion|ŭn′di-ver′shŭn|Surgical restoration of continuity in any organ system, the flow through which had previously been diverted; between the upper urinary tract and bladder after supravesical urinary diversion.
95594|undoing|ŭn-dū′ing|In psychology and psychiatry, an unconscious defense mechanism by which one symbolically acts out in reverse some earlier unacceptable behavior.
95595|undulate|ŭn′dū-lāt|Having an irregular, wavy border; denoting the shape of a bacterial colony.
32790|undulating fever||
54023|undulating membrane||a locomotory organelle of certain flagellate (trypanosome and trichomonad) parasites, consisting of a finlike extension of the limiting membrane with the flagellar sheath; wavelike rippling of the undulating membrane produces a characteristic movement.
74023|undulating pulse||a toneless pulse in which there is a succession of waves without character or force.
95596|undulipodium|ŭn′dū-li-pō′dē-ŭm, -ă|A flexible whiplike intracellular extension of many eukaryotic cells, with a characteristic ninefold symmetry, an arrangement of nine paired peripheral microtubules and one central pair, often termed 9 + 2 symmetry; it appears to grow out from a basal body (kinetosome) in the cell and is a fundamental component of the eukaryotic cell. Both the cilium and the eukaryotic flagellum (not the bacterial flagellum, which lacks the 9 + 2 pattern) are considered undulipodia.
18123|unequal cleavage||cleavage producing blastomeres of different sizes at the two poles.
74024|unequal pulse||differing strength of pulse in the same artery between the right and left of the circulation.
43575|unequal retinal image||
92598|unerupted tooth||a tooth prior to emergence;&#&a tooth unable to break out or emerge from the dental alveolar tissues into the oral cavity.
32356|unesterified free fatty acid (FFA, UFA)||free fatty acids that occur in plasma as a result of lipolysis in adipose tissue or when plasma triacylglycerols are taken into tissues.
21496|uneven crossing-over||crossing-over that happens when the breaks do not occur at precisely homologous points in two chromatid strands, and hence results in localized duplication of genetic material in one chromatid and complementary deletion in the other.
39122|unformed visual hallucination||hallucination composed of sparks, lights, or bursting spheres of light.
95597|ung||Abbreviation of L. unguentum, ointment.
95598|ungual|ŭng′gwăl|Relating to a nail or the nails.
67679|ungual phalanx||the distal phalanx of each of the digits; so called because of the flattened tuberosity at its termination that supports the nail.
94734|ungual tuberosity||
95599|unguent|ŭng′gwent|
95600|ungues|ŭng′gwēz|Plural of unguis.
95601|Unguiculata|ŭng-gwik′yū-lā′tă|A division of Mammalia including all mammals having nails or claws, as distinguished from the Ungulata.
95602|unguiculate|ŭng-gwik′yū-lāt|Having nails or claws, as distinguished from hooves.
95603|unguiculus|ŭn-gwik′yū-lŭs|A small nail or claw.
95604|unguinal|ŭng′gwi-năl|
95605|unguis|ŭng′gwis, -gwēz|
95606|unguis aduncus||
95607|unguis avis||
95609|unguis incarnatus||
95610|Ungulata|ŭng′gyū-lā′tă|A division of Mammalia containing the mammals with hooves, as distinguished from the Unguiculata.
95611|ungulate|ŭng′gyū-lāt|Having hooves.
95612|unguligrade|ŭng′gyū-li-grād|Walking on hooves, as by horses, pigs, and ruminants.
95613|uni-||One, single, not paired; corresponds to G. mono-.
95614|uniarticular|yū′nē-ar-tik′yū-lăr|
95615|uniaxial|yū′nē-ak′sē-ăl|Having but one axis; growing chiefly in one direction.
46473|uniaxial joint||one in which movement is around one axis only.
95616|unibasal|yū′ni-bā′săl|Having but one base.
95617|Uniblue A|yū′nē-blū|A protein stain used in electrophoresis.
95618|unicameral|yū-nē-kam′ĕr-ăl, -kam′ĕ-rāt|
22474|unicameral bone cyst||
22473|unicameral cyst||
83619|unicanalicular sphincter||a sphincter limited to one visceral canal or tube.
95619|unicellular|yū′ni-sel′yū-lăr|Composed of but one cell, as in the protozoons; for such unicellular organisms capable of undertaking life processes independently of other cells, the term acellular is also used.
37251|unicellular gland||a single secretory cell, such as a mucinogen-secreting goblet cell.
80258|unicellular sclerosis||a growth of fibrous tissue between and isolating the individual cells of a part.
95620|unicentral|yū′ni-sen′trăl|Having a single center, as of growth or of ossification.
95621|unicorn|yū′ni-kōrn|
96304|unicorn uterus||a uterus in which only one lateral half exists, the other half being undeveloped or absent.
95622|unicornous|yū′ni-kōr′nŭs, -nū-āte, -nāte|Having one horn, or cornu.
95623|unicuspid|yū′ni-kŭs′pid, -kŭs′pi-dāt|Having only one cusp, as a canine tooth.
76277|unidentified reading frame (URF)||
10792|unidirectional block||block that prevents passage of an impulse when it approaches from one direction but not from the other, as when block in the AV node prevents anterograde conduction to the ventricles whereas retrograde conduction to the atria remains intact.
34198|unidirectional flux||the flux of a substance from one surface of a boundary layer or membrane to the other, disregarding any counterbalancing flux in the other direction, as measured by tracer technique.
77454|unidirectional replication||replication in which there is movement by a single replication fork.
95624|unifamilial|yū′nē-fă-mil′ē-ăl|Relating to or occurring in a single family; denoting especially a nervous disease attacking several of the children in the same family in which no hereditary trait is apparent.
95625|uniflagellate|yū′ni-flaj′ĕ-lāt|
95626|uniforate|yū′ni-fō′rāt|Having but one foramen, pore, or opening of any kind.
95627|uniform|yū′ni-fōrm|Having but one form; not variable in form.&#&Of the same form or shape as another structure or object.
95628|unigerminal|yū′ni-jer′mi-năl|Relating to a single germ or zygote, monozygotic.
95629|uniglandular|yū′ni-glan′dyū-lăr|Involving, relating to, or containing but one gland.
95630|unilaminar|yū′ni-lam′i-năr, -lam′i-nāt|Having but one layer or lamina.
34429|unilaminar primary follicle||a primary ovarian follicle with a single layer of cuboidal follicular cells investing the primary oocyte.
95631|unilateral|yū′ni-lat′ĕ-răl|Confined to one side only.
3807|unilateral anesthesia||
39907|unilateral hemianopia||loss of sight in one half of the visual field of one eye only.
40510|unilateral hermaphroditism||hermaphroditism in which the doubling of sex characteristics occurs on one side only: ovotestis on one side and either ovary or testis on the other.
51505|unilateral hyperlucent lung||chronic bronchiolitis obliterans predominating on one side.
28736|unilateral lobar emphysema||radiographically hyperlucent lobe (or lung) secondary to bronchiolitis obliterans, with air trapping.
95632|unilobar|yū′ni-lō′băr|Having but one lobe.
95633|unilocal|yū′ni-lō′kăl|Strictly, denoting a trait in which the genetic component is contributed exclusively by one locus; in practice, any trait in which the contribution from one locus is so large that the data are readily interpreted as mendelian.
95634|unilocular|yū′ni-lok′yū-lăr|Having but one compartment or cavity, as in a fat cell.
22475|unilocular cyst||a cyst having a single sac.
32325|unilocular fat||adipose tissue in which the fat is present in a single droplet within the fat cells.
39908|unilocular hemianopia||
22476|unilocular hydatid cyst||the commonest form of hydatid cyst in humans, caused by Echinococcus granulosus and found in the liver, lungs, or any other site where the hexacanth embryo may settle if it passes the hepatic or pulmonary capillary filters; characterized by large balloonlike forms lined internally with a germinative membrane, enclosed externally in a laminated membrane within a host-parasite capsule, and filled with fluid (hydatid fluid) and infectious scoleces of the young tapeworms (hydatid sand).
46474|unilocular joint||one in which an intraarticular disc is incomplete or absent, the joint having but a single cavity.
95635|unimolecular|yū′ni-mō-lek′yū-lăr|Denoting a single molecule.
76249|unimolecular reaction||
58050|uninducible mutant||a mutant that cannot be induced.
10567|uninhibited neurogenic bladder||a condition, either congenital or acquired, of abnormal urinary bladder function whereby normal inhibitory control of detrusor function by the central nervous system is impaired or underdeveloped, resulting in urgency or enuresis.
87285|uninterrupted suture||
95636|uninuclear|yū′ni-nū′klē-ăr, -noo′klē-āt|Having but one nucleus.
95637|uniocular|yū′ni-ok′yū-lăr|Relating to one eye only.&#&Having vision in only one eye.
95638|union|yūn′yŭn|Joining or amalgamation of two or more bodies.&#&Structural adhesion or growing together of the edges of a wound.&#&Healing of a fracture represented by the development of continuity between fractured fragments.
95645|unioval|yū′nē-ō′văl, -ov′ū-lăr|Relating to or formed from a single oocyte.
95212|uniovular twins||
95646|unipennate|yū′ni-pen′āt|
57263|unipennate muscle||
95647|unipolar|yū′ni-pō′lăr|Having but one pole; denoting a nerve cell from which the branches project from one side only.&#&Situated at one extremity only of a cell.
15947|unipolar cell||
28231|unipolar electrocardiogram||an electrocardiogram taken with the exploring electrode placed on the chest overlying the heart or on a single limb, the indifferent (“zero” potential) electrode being the central terminal.
48575|unipolar leads||those in which the exploring electrode is on the chest in the vicinity of the heart or on one of the limbs, whereas the other or indifferent electrode is the central terminal.
60161|unipolar neuron||a neuron with a cell body that emits a single axonal process resulting from the fusion of two polar processes during development; at a variable distance from the cell body, the process divides into a peripheral axon branch extending outward as a peripheral afferent (sensory) nerve fiber and a central axon branch that enters into synaptic contact with neurons in the spinal cord or brainstem. With the single known exception of the neurons composing the mesencephalic nucleus of the trigeminus, unipolar neurons are the exclusive neural elements of the sensory ganglia. The lack of dendritic processes of these primary sensory neurons is only apparent: the dendritic pole of the unipolar neuron is represented by the unmyelinated terminal ramifications of the peripheral axon branch.
95648|uniport|yū′ni-pōrt|Transport of a molecule or ion through a membrane by a carrier mechanism (uniporter), without known coupling to any other molecule or ion transport.
95649|uniporter|yū′ni-pōrt′ĕr|A protein that mediates the transport of one molecule or ion through a membrane without known coupling to the transport of any other molecule or ion.
95650|unipotent|yū′ni-pō′tĕnt|Referring to those cells that produce a single type of daughter cell; a unipotent stem cell.
95651|uniseptate|yū′ni-sep′tāt|Having but one septum or partition.
95652|unit (U)|yū′nit|One; a single person or thing.&#&A standard of measure, weight, or any other quality, by multiplication or fractions of which a scale or system is formed.&#&A group of people or things considered as a whole because of mutual activities or functions.
15948|unit cell||the smallest portion or component of a crystal that, when combined with other unit cells, will make up the entire crystal lattice.
16541|unit character||
33066|unit fibrils||the fibrils that comprise a collagen fiber, ranging from 20–200 nm and averaging about 100 nm in diameter (substantially larger in tendons), with cross-striations averaging 64 nm.
54024|unit membrane||
20191|unit of convergence||
95690|unit of energy||CGS system: erg, joule;&#&MKS system: newton-meter (joule);&#&FPS system: foot-poundal;&#&gravitational unit: gram-centimeter, gram-meter, kilogram-meter, foot-pound;&#&SI: joule.
95698|unit of force||CGS system: dyne;&#&FPS system: poundal;&#&MKS system and SI: newton.
95701|unit of heat||calorie (gram calorie; kilocalorie);
95709|unit of intermedin||a unit based upon the action of the hormone in causing the expansion of the melanophores in a hypophysectomized frog; equal to 1 mcg of alkali-treated USP Posterior-pituitary Reference Standard.
95716|unit of length||metric system and SI: meter;&#&CGS system: centimeter;&#&variable in the English system: inch for short distances, foot for moderate distances and for elevation, mile for long distances.
95717|unit of light||
95720|unit of luminous flux||
95721|unit of luminous intensity||
95723|unit of luteinizing activity (international)||
95725|unit of magnetic field intensity||
95726|unit of magnetic flux intensity||
95727|unit of mass||metric system: gram;&#&SI: kilogram;&#&English system: pound.
95732|unit of ocular convergence||
95735|unit of oxytocin||the oxytocic activity of 0.5 mg of the USP Posterior-pituitary Reference Standard; 1 mg of synthetic oxytocin corresponds to 500 IU.
95736|unit of penicillin (international)||the penicillin activity of 0.6 mcg of penicillin G.
95741|unit of progestational activity (international)||
95744|unit of radioactivity||
95763|unit of thyrotrophic activity||the activity of an amount of an extract of the anterior lobe of the hypophysis that, given daily for 5 days, will cause the thyroid of a guinea pig (weighing 200 g) to reach a weight of 600 mg.
95768|unit of vasopressin||the pressor activity of 0.5 mg of the USP Posterior-pituitary Reference Standard; 1 mg of synthetic vasopressin corresponds to 600 IU.
95778|unit of wavelength||
95779|unit of weight||
95781|unit of work||
95782|United States Adopted Names (USAN)|yū-nī′tĕd stāts a-dopt′ĕd nāmz|Designation for nonproprietary names (for drugs) adopted by the USAN Council in cooperation with the manufacturers concerned; the designation USAN is applicable only to nonproprietary names coined since June 1961.
95783|United States Pharmacopeia (USP)|yū-nī′tĕd stāts far′ma-kō-pē′ă|
