95784|United States Public Health Service (USPHS)|yū-nī′tĕd stāts pŭb′lik helth ser′vis|A bureau of the Department of Health and Human Services, served by a corps of medical officers presided over by the Surgeon General, concerned with scientific research, domestic and insular quarantine, administration of government hospitals, publication of sanitary reports, and statistics; associated with it are the National Institutes of Health, Centers for Disease Control and Prevention, and other units.
13728|uniting canal||
14774|uniting cartilage||
26906|uniting duct||
95785|univalence|yū′ni-vā′lents, -vā′lent-sē|
95786|univalent|yū′ni-vā′lĕnt|
4763|univalent antibody||an “incomplete” form of antibody that has a single binding site; in the case of Rh+ erythrocytes, such an anti-Rh antibody may coat the cells but not cause them to agglutinate in saline; however, agglutination does occur when such coated cells are suspended in serum or other protein media, such as albumin, therefore called serum agglutinin.
3342|univariate analysis||techniques of multivariate analysis that can be used when analyzing variation in a data set in which there is only a single variable parameter of interest.
19936|univentricular connections||connections in which one of the atrial chambers is connected to a ventricle, but the other has no connection with the ventricular mass at all.
39548|univentricular heart||an anomaly in which all blood flows through one ventricle or in which the arterioventricular valves are committed to empty into only one chamber in the ventricular mass.
4805|universal antidote||a dated mixture of two parts activated charcoal, one part tannic acid, and one part magnesium oxide intended to be administered to patients who consumed poison. The mixture is ineffective and no longer used; activated charcoal is useful.
5765|universal appliance||a combination of the edgewise and ribbon arch appliance techniques, affording precise control of individual teeth in all planes of space.
26443|universal donor||in blood grouping, a person belonging to group O; one whose erythrocytes do not contain either agglutinogen A or B and are, therefore, not agglutinated by plasma containing either of the ordinary isoagglutinins.
44342|universal infantilism||
95787|Universal Precautions|yū′ni-ver′săl prē-kaw′shŭnz|(in full, Universal Blood and Body Fluid Precautions). A set of procedural directives and guidelines published in August 1987 by the U.S. Centers for Disease Control and Prevention (CDC) (as Recommendations for Prevention of HIV Transmission in Health-Care Settings) to prevent parenteral, mucous membrane, and nonintact skin exposures of health care workers to bloodborne pathogens. In December 1991, the Occupational Safety and Health Administration (OSHA) promulgated its Occupational Exposure to Bloodborne Pathogens Standard, incorporating universal precautions and imposing detailed requirements on employers of health care workers, including engineering controls, provision of protective barrier devices, standardized labeling of biohazards, mandatory training of employees in Universal Precautions, management of accidental parenteral exposure incidents, and availability to employees of immunization against hepatitis B.
82834|universal solvent||a substance sought by the alchemists, and claimed by some to have been found, supposedly capable of dissolving all substances; sometimes, in a physiologic sense, applied to water.
82824|University of Wisconsin solution||a normokalemic, intracellular colloid injected into vital organs during harvesting to preserve function before transplantation.
95788|unmedullated|ŭn-med′yū-lāt′ĕd|
16046|unmodified zinc oxide-eugenol cement||a dental cement obtained by mixing zinc oxide and eugenol without modifiers.
95789|unmyelinated|ŭn-mī′ĕ-li-nāt′ed|Denoting nerve fibers (axons) lacking a myelin sheath.
32989|unmyelinated fibers||fibers having no myelin covering, naked axons; in the central nervous system, represented by all axons lying in troughs of oligodendroglia, and in the peripheral nervous system, by all axons lying in troughs in a single Schwann cell (Schwann cell unit); slow-conducting fiber.
59622|unmyelinated nerve||a nerve made up largely, or exclusively, of unmyelinated fibers; a nerve composed of axons having no myelin covering, but lying in troughs in Schwann cells; a slow-conducting nerve.
95790|Unna|ūn′ah|Paul G., German dermatologist and staining expert, 1850–1929.
25862|Unna disease|ūn′ah|
60410|Unna nevus|ūn′ah|capillary stain on nape of neck; persistent form of nevus flammeus nuchae.
84520|Unna stain|ūn′ah|an alkaline methylene blue stain for plasma cells;&#&a polychrome methylene blue stain with which mast cells are stained red (metachromatic).
84521|Unna-Pappenheim stain|ūn′ah pahp′ĕn-hīm|a contrast stain consisting of a methyl green-pyronin solution; originally used for gonococci, but later used to detect RNA and DNA in tissue sections; RNA is stained red and DNA appears green; used to demonstrate plasma cells during chronic inflammation.
84522|Unna-Taenzer stain|ūn′ah tān′tzer|
88338|Unna-Thost syndrome|ūn′ah tost|
88981|Unna-Thost syndrome|ūn′ah tost|
95791|unofficial|ŭn′ŏ-fi′shăl|Denoting a drug that is not listed in the United States Pharmacopeia or the National Formulary.
2390|unpaired allosome||
17501|unpaired chromosome||
70047|unpaired thyroid venous plexus||a venous plexus in front of the lower portion of the trachea formed by anastomoses between the inferior laryngeal veins and veins emerging from the caudal border of the thyroid; it terminates in the unpaired inferior thyroid vein.
95792|unphysiologic|ŭn-fiz′ē-ō-loj′ik|Pertaining to conditions in the organism that are abnormal; can be used to refer to subjecting the body to abnormal amounts of substances normally present.
70395|unresolved pneumonia||pneumonia in which the alveolar exudate persists and eventually undergoes fibrosis.
88982|unroofed coronary sinus syndrome||a spectrum of cardiac anomalies in which part or all of the common wall between the coronary sinus and the left atrium is absent.
88339|unroofed coronary sinus syndrome||a spectrum of cardiac anomalies in which part or all of the common wall between the coronary sinus and the left atrium is absent.
95793|unsanitary|ŭn-san′i-tār′ē|
95794|unsaturated|ŭn-sach′ŭr-āt′ĕd|Not saturated; denoting a solution in which the solvent is capable of dissolving more of the solute.&#&Denoting a chemical compound in which all the affinities are not satisfied, so that still other atoms or radicals may be added to it.&#&In organic chemistry, denoting compounds containing double and/or triple bonds or a ring structure.
2078|unsaturated alcohols||those alcohols with carbon chains that contain one or more carbon-carbon double or triple bonds.
32326|unsaturated fat||
32357|unsaturated fatty acid||a fatty acid, the carbon chain of which possesses one or more double or triple bonds (oleic acid, with one double bond in the molecule, and linoleic acid, with two); called unsaturated because it is capable of absorbing additional hydrogen.
95795|unsex|ŭn′seks|To castrate; to deprive of the gonads.
52995|unsharp masking||in radiography, superimposing a blurred negative of a radiograph to cancel large density differences, leaving fine detail more visible.
3936|unstable angina||angina pectoris characterized by pain or sensation of pressure in the chest which is of coronary origin occurring in response to progressively less exercise (or none) or fewer other stimuli than ordinarily required to produce angina; often leading to myocardial infarction, if untreated.&#&angina that has not achieved a constant or reproducible pattern in 30 or 60 days.
10568|unstable bladder||characterized by uninhibited detrusor contractions.
18955|unstable colloid||
30093|unstable equilibrium||equilibrium in which the response to a small perturbation will tend to make the perturbation greater (a logged feedback process of zero order).
35393|unstable fracture||a fracture with an intrinsic tendency to displace after reduction.
3693|unstable hemoglobin hemolytic anemia||a congenital hemolytic anemia, due to autosomal inheritance of one of many unstable hemoglobins. The anemia is of variable severity and characterized by the presence in vivo or in vitro of Heinz bodies.
40128|unstable hemoglobins||a group of rare Hb's with amino acid substitutions (or amino acid deletions in three types) that alter the three-dimensional shape of the globin in a manner that renders the molecule unstable; they have an increased but variable tendency to autooxidation and Heinz body formation and are associated with congenital nonspherocytic hemolytic anemia. The unstable β-chain abnormalities include Hb's Genova, Gun Hill, Hammersmith, Köln, Philly, Sabine, Santa Ana, Sydney, Wien, and Zürich; unstable α-chain abnormalities include Hb's Bibba, Sinai, and Torino.
49336|unstable lie||oblique orientation of the fetus that is neither transverse nor longitudinal, but that converts to one or the other before or during labor.
77340|unstrained jaw relation||
95796|unstriated|ŭn-strī′āt-ĕd|Without striations; not striped; denoting the structure of the smooth or involuntary muscles.
57264|unstriated muscle||
23483|unsystematized delusion||one of a group of apparently discrete, disconnected delusions.
95797|unthrifty|ŭn-thrif′tē|In animals, denoting a failure to grow or develop normally as a result of disease.
35394|ununited fracture||a fracture in which union between the ends of the bone fails to occur.
95798|Unverricht|ūn′fĕr-ikt|Heinrich, German internist, 1853–1912.
25863|Unverricht disease|ūn′fĕr-ikt|a progressive myoclonic epilepsy; one of the degenerative gray matter disorders characterized by myoclonus and generalized seizures, with progressive neurologic and intellectual decline; age of onset between 8–13 years of age; autosomal recessive inheritance, caused by mutation in the cystatin B gene (CSTB) on 21q22.
73054|unwinding proteins||enzymes that uncoil the DNA allowing recombination events to occur.
58085|up promoter mutation||a mutation that increases the frequency of initiation of transcription.
61991|upbeat nystagmus||a vertical jerk nystagmus with a rapid component upward, occurring with brainstem lesions.
95799|UPJ||Abbreviation for ureteropelvic junction.
76967|upper abdominal periosteal reflex||percussing the lower margin of the costal cartilages in the nipple line causes a contraction of the ipsilateral abdominal muscles (inconstant).
1886|upper airway||the portion of the respiratory tract that extends from the nares or mouth to and including the larynx.
88340|upper airway resistance syndrome (UARS)||a condition associated with increased blockage of the airway or increased airway resistance, usually without a decrease in oxygen saturation.
88983|upper airway resistance syndrome (UARS)||a condition associated with increased blockage of the airway or increased airway resistance, usually without a decrease in oxygen saturation.
5944|upper dental arcade||
20028|upper esophageal constriction||
31233|upper extremity||
31234|upper extremity of fibula||
31299|upper eyelid||
81181|upper gastrointestinal series (UGIS)||a radiographic contrast study of the esophagus, stomach, and duodenum.
39408|upper head of lateral pterygoid muscle||head of origin from the infratemporal surface and crest of the greater wing of the sphenoid; this part of the muscle attaches to the discocapsular system (fibrous layer of the joint capsule and articular disc) of the temporomandibular joint and has been determined by electromyography to be active during both protrusion and retrusion of the mandible serving in both to ensure that the disc moves in concert with the excursion of the head of the mandible.
46223|upper jaw||
11351|upper jaw bone||
59623|upper lateral cutaneous nerve of arm||the terminal branch of the axillary nerve supplying the skin over the lower portion of the deltoid and for a distance below its insertion.
49329|upper lid||
50263|upper limb||the shoulder, arm, forearm, wrist, and hand.
50697|upper lip||the muscular fold forming the superior border of the mouth.
51088|upper lobe of lung||
60162|upper motor neuron||clinical term indicating those neurons of the motor cortex that contribute to the formation of the corticospinal and corticonuclear (corticobulbar) tracts, as distinguished from the lower motor neurons innervating the skeletal muscles. Although not motor neurons in the strict sense, these cortical neurons became colloquially classified as motor neurons because their activation produces movement and their destruction causes moderate to severe disorders of movement.
48952|upper motor neuron lesion||injury to the descending motor pathways cephalad to the brainstem or spinal motor nuclei.
70713|upper pole||
70714|upper pole of testis||the superior end of the testis.
44401|upper respiratory infection (URI)||
59624|upper subscapular nerve||
59625|upper thoracic splanchnic nerves||
80642|upper uterine segment||the main portion of the body of the gravid uterus, the contraction of which furnishes the chief force of expulsion in labor.
95800|upregulation|ŭp′reg-yū-lā′shŭn|Opposite of down-regulation.
43098|upregulation/downregulation hypothesis||a theory of the neurochemical basis of depression (an elaboration of the monoamine hypothesis) linking it to an increase in number (upregulation) of postsynaptic monoamine receptors, which are then effectively decreased in number (downregulation) as a result of antidepressant activity.
95801|UPS||Abbreviation for ubiquitin-proteasome system.
95802|upsiloid|ŭp′si-loyd|
95803|upsilon|up′si-lon|The 20th letter of the Greek alphabet, Ψ.
95804|upstream|ŭp′strēm|Refers to nucleic acid base sequences proceeding the opposite direction from expression.
95805|uptake|ŭp′tāk|The absorption by a tissue of some substance, food material, mineral, and its permanent or temporary retention.
95852|ur-defenses|yūr′dē-fens′ĕz|A rarely used term for primitive defenses.
95806|Ura||Abbreviation for uracil.
95807|urachal|yūr′ă-kăl|Relating to the urachus.
22477|urachal cyst||a cystic remnant in the urachus derived from the intraembryonic part of the allantois.
33718|urachal fistula||an abnormal passage or fistula between the urinary bladder and the umbilicus.
34363|urachal fold||
49835|urachal ligament||
95808|urachus|yūr′ă-kŭs|That part of the allantois between the apex of the bladder and the umbilicus; postnatally, the urachus is normally merely a fibrous cord, the median umbilical ligament, but occasionally the allantoic lumen may persist as a urachal fistula.
95809|uracil (Ura, U)|yūr′ă-sil|Pyrimidine (base) present in ribonucleic acid.
95810|uracil dehydrogenase||an oxidoreductase catalyzing oxidation of uracil to barbituric acid; also oxidizes thymine.
95811|uracil mustard||an alkylating antineoplastic agent.
95812|uracil oxidase||
95813|uracil phosphoribosyltransferase||
95814|uracil-6-carboxylic acid|yūr′ă-sil-kar′boks-il′il as′id|
95815|Uragoga|yūr′ă-gō′gă|A genus of tropical plants (family Rubiaceae). Uragoga ipecacuanha (Cephaelis ipecacuanha) is the source of Rio or Brazilian ipecac; Uragoga acuminata (C. acuminata) is the source of Cartagena, Nicaragua, or Panama ipecac.
95816|uramustine|yūr′ă-mŭs′tēn|
95817|uranin|yū′ră-nin|
95818|uraninite|yū-ran′i-nīt|
95819|uranisco-||
95820|uraniscochasm|yū′ră-nis′kō-kazm|
95821|uranisconitis|yū′ră-nis′kō-nī′tis|
95822|uraniscoplasty|yū′ră-nis′kō-plas′tē|
95823|uraniscorrhaphy|yū′ră-nis-kōr′ă-fē|
95824|uraniscus|yū′ră-nis′kŭs|
95825|uranium (U)|yū-rā′nē-ŭm|A radioactive metallic element, atomic no. 92, atomic wt. 238.0289, occurring mainly in pitchblende and notable for its two isotopes: ²³⁸U and ²³⁵U (99.2745% and 0.720%, respectively, the rest being made up by ²³⁴U), ²³⁵U being the first substance ever shown capable of supporting a self-sustaining chain reaction.
59180|uranium nephritis||an experimental nephritis produced by the administration of uranium nitrate.
95826|urano-||The hard palate.
95827|uranoplasty|yū′ră-nō-plas′tē|
95828|uranorrhaphy|yū′ră-nōr′ă-fē|
95829|uranoschisis|yū′ră-nos′ki-sis|Cleft of the hard palate.
95830|uranostaphyloplasty|yū′ră-nō-staf′i-lō-plas′tē|Repair of a cleft of both hard and soft palates.
95831|uranostaphylorrhaphy|yū′ră-nō-staf′i-lōr′ă-fē|
95832|uranostaphyloschisis|yū′ră-nō-staf′i-los′ki-sis|Cleft of the soft and hard palates.
95833|uranoveloschisis|yū′ră-nō-vĕ-los′ki-sis|
95834|uranyl|yūr′ă-nil|The ion, UO₂²⁺, usually found in such salts as uranyl nitrate, UO₂(NO₃)₂; uranyl acetate, UO₂(CH₃COO)₂, is used in electron microscopy.
84523|uranyl acetate stain||a stain used in electron microscopy; uranyl acetate binds specifically to nucleic acids but selectively tends to be abolished by osmium fixation; proteins are well-stained, but cytomembranes are poorly stained.
95835|uraroma|yū′ră-rō′mă|An obsolete term to describe a spicy, aromatic odor of the urine.
95836|urarthritis|yū′rar-thrī′tis|Gouty inflammation of a joint.
95837|urate|yū′rāt|A salt of uric acid.
84524|urate crystals stain||a stain using silver methenamine to detect crystals, which polarize light in contrast with calcium crystals; useful in diagnosing gout and kidney infarcts resulting from uric acid build-up.
95838|urate oxidase||a copper-containing, oxygen-requiring oxidoreductase that oxidizes uric acid; used in the clinical diagnosis of increased uric acid levels.
95839|uratemia|yū′rā-tē′mē-ă|The presence of urates, especially sodium urate, in the blood.
95840|urateribonucleotide phosphorylase|yūr′āt-rī′bō-nū′klē-ō-tīd fos-fō′ril-ās|A ribosyltransferase that reacts urate d-ribonucleotide with orthophosphate to produce urate plus d-ribose 1-phosphate.
95841|uratic|yū-rat′ik|Pertaining to a urate or to urates.
95842|uratolysis|yū′ră-tol′i-sis|The decomposition or solution of urates.
95843|uratolytic|yū′ră-tō-lit′ik|Causing the decomposition, or solution and removal of urates, from the tissues.
95844|uratoma|yū′ră-tō′mă|
95845|uratosis|yū′rā-tō′sis|Any morbid condition due to the presence of urates in the blood or tissues.
95846|uraturia|yū′rā-tyū′rē-ă|The passage of an increased amount of urates in the urine.
95847|Urbach|ŭr′bak|Erich, U.S. dermatologist, 1893–1946.
25864|Urbach-Wiethe disease|ŭr′bak vē′tĕ|
95848|Urban|ŭr′băn|Jerome A., 20th-century U.S. surgeon.
48712|urban cutaneous leishmaniasis||
62919|Urban operation|ŭr′băn|extended radical mastectomy, including en bloc resection of internal mammary lymph nodes, part of the sternum, and costal cartilages.
95332|urban typhus||
95849|urceiform|yūr-sē′i-fōrm|Pitcher-shaped.
95850|urceolate|yūr-sē′ō-lāt|
95851|Urd||Abbreviation for uridine.
95853|ure-||Urea; urine.
95854|urea|yū-rē′ă|The chief end product of nitrogen metabolism in mammals, formed in the liver by means of the Krebs-Henseleit cycle and excreted in normal adult human urine in the amount of about 32 g a day (about 85% of the nitrogen excreted from the body). It may be obtained artificially by heating a solution of ammonium cyanate. It occurs as colorless or white prismatic crystals, without odor but with a cooling saline taste, is soluble in water, and forms salts with acids; has been used as a diuretic in kidney function tests, and topically for various dermatitides.
18099|urea clearance||the volume of plasma (or blood) that would be completely cleared of urea by 1 minute's excretion of urine; originally calculated as urine flow multiplied by urine urea concentration divided by concentration of urea in whole blood rather than plasma, representing blood urea clearance rather than plasma urea clearance.
90889|urea clearance test||a test of renal function based on urea clearance.
22228|urea cycle||the sequence of chemical reactions, occurring primarily in the liver, that results in the production of urea; the key reaction is the hydrolysis of l-arginine by arginase to l-ornithine and urea; l-ornithine is then converted to l-citrulline by a carbamoylation reaction, then to l-argininosuccinate by an amination reaction involving l-aspartic acid; finally, a lyase-dependent step generates arginine and fumarate.
35604|urea frost||
60534|urea nitrogen||the portion of nitrogen in a biologic sample, such as blood or urine, that derives from its content of urea.
95855|urea peroxide||a white crystalline compound used in an aqueous solution as an oxidizing mouthwash.
95856|urea stibamine||a urea derivative of stibanilic acid, used in the treatment of kala azar and certain other tropical diseases.
95857|ureagenesis|yū-rē′ă-jen′ĕ-sis|Formation of urea, usually referring to the metabolism of amino acids to urea.
95858|ureal|yū-rē′ăl|Relating to or containing urea.
95859|Ureaplasma|yū-rē′ă-plaz′mă|A genus of microaerophilic to anaerobic, nonmotile bacteria (family Mycoplasmataceae) with no cell walls. Gram-negative, they are predominantly coccoidal to coccobacillary elements, approximately 0.3 mcm in diameter, which frequently grow in short filaments; colonies are generally small, 20–30 mcm in diameter, and may have no zones of surface growth. Ureaplasma hydrolyze urea with production of ammonia, and are found in the human genitourinary tract, occasionally in the pharynx and rectum. In males, they are associated with nongonococcal urethritis and prostatitis; in females, with genitourinary tract infections and reproductive failure; in neonates, they may cause pneumonia or meningitis. The type species is Ureaplasma urealyticum.
95860|Ureaplasma urealyticum||a species that has been isolated from the respiratory tract and central nervous system of newborns. It causes infections of the genitourinary tract, particularly urethritis; thought to be sexually transmitted and transmitted from mother to infant. The laboratory diagnosis is simplified through the use of urea-containng agar, permitting detection of the tiny colonies.
95861|ureapoiesis|yū-rē′ă-poy-ē′sis|
95862|urease|yūr′ē-ās|An enzyme that catalyzes the hydrolysis of urea to carbon dioxide and ammonia; used as an antitumor enzyme; it is present in intestinal bacteria and accounts for most of the ammonia generated from urea in mammals.
90890|urease test||a test for urea based on the conversion of urea into ammonium carbonate by the enzyme urease;&#&a test for the production of urease, used for identification of Cryptococci and Helicobacter pylori.
90891|urecholine supersensitivity test||urodynamic test that tries to elicit an abnormal cystometrogram after subcutaneous injection of a drug, urecholine. Urecholine may increase detrusor pressure response during filling in people with some types of neuropathic bladder.
95863|uredema|yū′re-dē′mă|Edema due to infiltration of urine into the subcutaneous tissues.
95864|ureic|yū-rē′ik|
95865|ureide|yūr′ē-īd|Any compound of urea in which one or more of its hydrogen atoms have been substituted by acid radicals.
95869|ureidosuccinic acid|yū-rē′i-dō-sŭk-sin′ik as′id|A precursor of the pyrimidines.
95870|urelcosis|yū′rel-kō′sis|Obsolete term for ulceration of any part of the urinary tract.
95871|uremia|yū-rē′mē-ă|An excess of urea and other nitrogenous waste in the blood.&#&The complex of symptoms due to severe persisting renal failure that can be relieved by dialysis.
95873|uremic|yū-rē′mik|Relating to uremia.
12285|uremic breath||characteristic odor of the breath in patients with chronic renal failure, variously described as “fishy,” “ammoniac,” and “fetid,” which is indicative of the systemic accumulation of volatile metabolites, usually excreted in the urine; dimethylamine and trimethylamine have been identified and correlated with the classic fishy odor.
18866|uremic colitis||colitis characterized by hemorrhages in the mucosa, occurring in renal failure, possibly owing to the irritant effect of ammonia formed by breakdown of increased urea in the intestinal secretions.
19203|uremic coma||a metabolic encephalopathy caused by renal failure.
51506|uremic lung||perihilar edema of the lung associated with renal failure and hypertension; the peripheral parts of the lung remain clear.
66951|uremic pericarditis||
70396|uremic pneumonia||terminal infective pneumonia occurring in a patient with uremia.
70407|uremic pneumonitis||
70974|uremic polyneuropathy||a distal sensory and motor polyneuropathy without conspicuous inflammation and ascribed to the metabolic effects of chronic renal failure.
95874|uremigenic|yū-rē′mi-jen′ik|Of uremic origin or causation.&#&Causing or resulting in uremia.
95875|ureo-||
95876|ureotele|yū′rē-ō-tēl|An organism that is ureotelic; primates.
95877|ureotelia|yū′rē-ō-tēl′ē-a|The process or type of nitrogen excretion in which urea is the primary end product.
95878|ureotelic|yū′rē-ō-tel′ik|Excreting nitrogen primarily in the form of urea.
95879|urerythrin|yuūr-ĕr′i-thrin|
95880|uresiesthesia|yū-rē′si-es-thē′zē-ă|The desire to urinate.
95881|uresis|yū-rē′sis|
95882|ureter|yū-rē′tĕr, yū′rē-ter|The tube that conducts the urine from the renal pelvis to the bladder; consists of abdominal and pelvic parts; lined with transitional epithelium surrounded by smooth muscle, both circular and longitudinal, and covered externally by an adventitia.
95890|ureteral|yū-rē′tĕr-ăl|Relating to the ureter.
12233|ureteral branches||
18837|ureteral colic||paroxysm of pain due to abrupt obstruction of ureter from a calculus or blood clot in most instances.
